DRUGS_ID,DRUGS_NAME,INN_ID,INN_NAME,NFC1_ID,EVENTS_COUNT,SHARE_INTERNAL,SHARE_LOST,SHARE_SAME_NFC1,SHARE_DIFF_NFC1,INTERNAL_LIFT,LOST_SALES,TOTAL_EFFECT,AVG_STOCKOUT_WEEKS,CLASSIFICATION
630864,"ИБУПРОФЕН 400, Лекхим ЧАО (Украина, Киев), табл. п/плен. оболочкой 400 мг блистер, #50",3138,ИБУПРОФЕН,Пероральные твердые обычные,1,0.972762,0.027238,0.95318,0.04682,240.711,6.74,247.451,71.0,SUBSTITUTABLE
631003,"ЭСТЕЗИФИН, Фармак АО (Украина, Киев), р-р накожный 1 % фл. 25 мл, #1",2963,НАФТИФИН,"Местно действующие, дерматологические, антигеморроидальные, наружные",17,0.5905371176470587,0.40946288235294115,1.0,0.0,75.6867,66.7223,142.409,6.529411764705882,CRITICAL
636736,"ТЕРМИДОЛ, Киевский витаминный завод АО (Украина, Киев), капс. мягкие 400 мг блистер, #10",3138,ИБУПРОФЕН,Пероральные твердые обычные,12,0.8426696666666667,0.15733033333333332,0.7816840833333334,0.21831591666666664,320.7109,45.7618,366.4727,6.083333333333333,SUBSTITUTABLE
639786,"ДИКЛОСЕЙФ®, Кусум Фарм ООО (Украина, Киев), гель эмулс. д/наруж. прим. 1,16 % туба 100 г, #1",3170,ДИКЛОФЕНАК,"Местно действующие, дерматологические, антигеморроидальные, наружные",2,0.8689275000000001,0.1310725,1.0,0.0,69.42999999999999,6.69,76.12,49.5,SUBSTITUTABLE
639788,"ДИКЛОСЕЙФ® ФОРТЕ, Кусум Фарм ООО (Украина, Киев), гель эмулс. д/наруж. прим. 2,32 % туба 100 г, #1",3170,ДИКЛОФЕНАК,"Местно действующие, дерматологические, антигеморроидальные, наружные",4,0.81372125,0.18627875,1.0,0.0,94.61410000000001,38.58,133.1941,26.25,SUBSTITUTABLE
643137,"СОЛАРГИН, Macleods Pharmaceuticals Ltd (Индия), р-р д/инф. 42 мг/мл контейнер 100 мл, #1",350,АРГИНИН,Парентеральные обычные,2,0.538588,0.461412,1.0,0.0,10.7,37.8397,48.5397,11.5,CRITICAL
650512,"БРУФЕН® РАПИД, Abbott Products GmbH  (Германия), капс. мягкие 400 мг блистер, #10",3138,ИБУПРОФЕН,Пероральные твердые обычные,17,0.8215943529411764,0.17840564705882353,0.7753131176470588,0.22468688235294118,276.9095,62.133,339.0422,4.9411764705882355,SUBSTITUTABLE
654620,"ДЕЗЛОРАТАДИН-ТЕВА, Teva (Израиль), табл. п/плен. оболочкой 5 мг блистер, #10",40218,ДЕЗЛОРАТАДИН,Пероральные твердые обычные,5,0.8773578000000001,0.12264219999999999,0.6401942,0.3598058,135.44660000000002,7.3824000000000005,142.829,17.6,SUBSTITUTABLE
654842,"НУРОФЕН ЭКСПРЕСС ФОРТЕ, Reckitt Benckiser Healthcare International  (Великобритания), капс. мягкие 400 мг, #20",3138,ИБУПРОФЕН,Пероральные твердые обычные,26,0.8165763461538462,0.18342365384615383,0.7814645,0.21853550000000002,296.4318,75.5168,371.9485,2.6153846153846154,SUBSTITUTABLE
660135,"ЭРИДЕЗ, Дарница ЧАО (Украина, Киев), табл., дисперг. в рот. полости 5 мг блистер, #10",40218,ДЕЗЛОРАТАДИН,Пероральные твердые обычные,1,0.790817,0.209183,0.568818,0.431182,3.7805,1.0,4.7805,2.0,SUBSTITUTABLE
665593,"ИБУПРОМ МАКС РР, Дельта Медикел ООО (Украина, Вишневое), табл. п/плен. оболочкой 400 мг блистер, #12",3138,ИБУПРОФЕН,Пероральные твердые обычные,3,0.8373243333333334,0.1626756666666667,0.8680903333333333,0.13190966666666668,42.5715,5.5156,48.087199999999996,1.6666666666666667,SUBSTITUTABLE
671175,"ЭКЗО-ТИФИН, Здоровье Группа компаний ООО (Украина, Харьков), р-р накожный 10 мг/г фл. 20 мл, #1",2963,НАФТИФИН,"Местно действующие, дерматологические, антигеморроидальные, наружные",4,0.73323,0.26677,1.0,0.0,42.8513,9.01,51.8613,11.5,SUBSTITUTABLE
684691,"БРУФЕН® РЕТАРД, Abbott Products GmbH  (Германия), табл. пролонг. п/плен. обол. 800 мг блистер, #14",3138,ИБУПРОФЕН,Пероральные твердые длительно действующие,9,0.8766326666666667,0.12336733333333333,0.0,1.0,272.7493,23.4371,296.1866,6.0,SUBSTITUTABLE
702760,"ДИКЛОФЕНАК, Виола ФФ ЧАО (Украина, Запорожье), гель 5 % туба алюм. 50 г, в пачке",3170,ДИКЛОФЕНАК,"Местно действующие, дерматологические, антигеморроидальные, наружные",5,0.7905528,0.2094472,1.0,0.0,22.0666,8.5559,30.6225,2.4,SUBSTITUTABLE
741033,"НУРОФЕН ЭКСПРЕСС УЛЬТРАКАП, Reckitt Benckiser Healthcare International  (Великобритания), капс. мягкие 200 мг, #16",3138,ИБУПРОФЕН,Пероральные твердые обычные,11,0.847147090909091,0.1528529090909091,0.7519761818181817,0.24802381818181818,428.0066,13.6509,441.6575,9.545454545454545,SUBSTITUTABLE
743233,"ПРЕГАБАЛИН-ДАРНИЦА, Дарница ЧАО (Украина, Киев), капс. 300 мг контурн. ячейк. уп., #21",80617,ПРЕГАБАЛИН,Пероральные твердые обычные,1,1.0,0.0,1.0,0.0,40.6188,0.0,40.6188,11.0,SUBSTITUTABLE
746868,"ДИКЛОФЕНАК-ТЕВА ФОРТЕ 2%, Teva (Израиль), гель 2 % туба 50 г, #1",3170,ДИКЛОФЕНАК,"Местно действующие, дерматологические, антигеморроидальные, наружные",2,0.8877235,0.1122765,1.0,0.0,57.478300000000004,6.98,64.4583,37.0,SUBSTITUTABLE
757899,"НО-ШПА® ФОРТЕ, Opella Healthcare International  (Франция), табл. 80 мг блистер, #10",3147,ДРОТАВЕРИН,Пероральные твердые обычные,22,0.5864337727272727,0.41356622727272724,1.0,0.0,90.327,72.0031,162.3301,4.136363636363637,CRITICAL
761708,"БИЛАГИС, Фармак АО (Украина, Киев), табл. 20 мг блистер, #10",298137,БИЛАСТИН,Пероральные твердые обычные,2,0.5865954999999999,0.41340449999999995,1.0,0.0,5.8567,5.64,11.4967,7.5,CRITICAL
761709,"БИЛАГИС, Фармак АО (Украина, Киев), табл. 20 мг блистер, #30",298137,БИЛАСТИН,Пероральные твердые обычные,9,0.6598064444444445,0.3401935555555555,1.0,0.0,45.4074,28.1269,73.5342,10.777777777777779,SUBSTITUTABLE
773377,"ЗОНИК, Кусум Фарм ООО (Украина, Киев), капс. тверд. 25 мг блистер, #28",80617,ПРЕГАБАЛИН,Пероральные твердые обычные,3,0.677906,0.322094,0.9850186666666666,0.014981333333333333,56.1147,30.0503,86.16499999999999,17.666666666666668,SUBSTITUTABLE
773380,"ЗОНИК, Кусум Фарм ООО (Украина, Киев), капс. тверд. 50 мг блистер, #28",80617,ПРЕГАБАЛИН,Пероральные твердые обычные,6,0.8691135,0.13088650000000002,0.9380743333333333,0.06192566666666668,149.587,10.0019,159.5891,18.333333333333332,SUBSTITUTABLE
775520,"ДАРФЕН® ЭКСПРЕСС, Дарница ЧАО (Украина, Киев), сусп. оральн. 200 мг/10 мл саше 10 мл, #10",3138,ИБУПРОФЕН,Пероральные жидкие обычные,2,1.0,0.0,0.3932775,0.6067225,209.4919,0.0,209.4919,34.0,SUBSTITUTABLE
813369,"ЭДОКСАКОРД, Киевский витаминный завод АО (Украина, Киев), табл. п/плен. оболочкой 60 мг блистер, #30",790221,ЭДОКСАБАН,Пероральные твердые обычные,16,0.125,0.875,1.0,0.0,2.0,44.074799999999996,46.074799999999996,6.8125,CRITICAL
813371,"ЭДОКСАКОРД, Киевский витаминный завод АО (Украина, Киев), табл. п/плен. оболочкой 30 мг блистер, #30",790221,ЭДОКСАБАН,Пероральные твердые обычные,1,0.486767,0.513233,1.0,0.0,2.3975,2.5279,4.9254,4.0,CRITICAL
822324,"ОЛФЕН® ФОРТЕ ГИДРОГЕЛЬ, Teva (Израиль), гель 2 % туба 50 г, #1",3170,ДИКЛОФЕНАК,"Местно действующие, дерматологические, антигеморроидальные, наружные",5,0.8100913999999999,0.1899086,1.0,0.0,64.7436,17.9097,82.6533,11.0,SUBSTITUTABLE
822325,"ОЛФЕН® ФОРТЕ ГИДРОГЕЛЬ, Teva (Израиль), гель 2 % туба 100 г, #1",3170,ДИКЛОФЕНАК,"Местно действующие, дерматологические, антигеморроидальные, наружные",5,0.8788324,0.1211676,1.0,0.0,54.7246,5.4398,60.1644,6.8,SUBSTITUTABLE
825568,"ПРЕГАБАЛИН-ТЕВА, Teva (Израиль), капс. тверд. 75 мг блистер, #28",80617,ПРЕГАБАЛИН,Пероральные твердые обычные,10,0.8517498,0.1482502,0.9866872000000001,0.0133128,137.7418,22.3764,160.1182,5.1,SUBSTITUTABLE
832883,"ДОЛГИТ® КРЕМ, Naturwaren (Германия), крем туба 150 г, #1",3138,ИБУПРОФЕН,"Местно действующие, дерматологические, антигеморроидальные, наружные",7,0.423617,0.576383,1.0,0.0,37.7237,33.9067,71.6304,14.0,CRITICAL
867660,"ДИКЛОСЕЙФ® ФОРТЕ, Кусум Фарм ООО (Украина, Киев), гель эмулс. д/наруж. прим. 2,32 % туба 50 г, #1",3170,ДИКЛОФЕНАК,"Местно действующие, дерматологические, антигеморроидальные, наружные",12,0.7311571666666666,0.2688428333333333,1.0,0.0,88.3886,27.1043,115.493,6.416666666666667,SUBSTITUTABLE
876236,"ДАРФЕН®, Дарница ЧАО (Украина, Киев), табл. п/о 400 мг блистер, #7",3138,ИБУПРОФЕН,Пероральные твердые обычные,1,0.988496,0.011504,0.55317,0.44683,73.0387,0.85,73.8887,7.0,SUBSTITUTABLE
883339,"АМИНАРГИН, Новофарм-Биосинтез Фирма ООО (Украина, Звягель (Новоград-Волынский)), р-р д/инф. 42 мг/мл бутылка 100 мл",350,АРГИНИН,Парентеральные обычные,3,0.45126166666666667,0.5487383333333334,1.0,0.0,16.8382,79.8631,96.7013,8.0,CRITICAL
890802,"ДИКЛАК® ГЕЛЬ, Sandoz (Швейцария), гель 5 % туба 150 г, #1",3170,ДИКЛОФЕНАК,"Местно действующие, дерматологические, антигеморроидальные, наружные",1,0.750693,0.249307,1.0,0.0,7.6181,2.53,10.1481,2.0,SUBSTITUTABLE
891717,"ТРОКСЕРУТИН, Юнифарма ООО (Украина, Киев), гель 2 % туба 40 г, в пачке, #1",2733,ТРОКСЕРУТИН,"Местно действующие, дерматологические, антигеморроидальные, наружные",4,0.4920065,0.5079935,1.0,0.0,13.577199999999998,13.296500000000002,26.8737,7.0,CRITICAL
909840,"ЕВРОФАСТ СОФТКАПС, Euro Lifecare  (Великобритания), капс. мягкие 400 мг блистер, в карт. коробке, #20",3138,ИБУПРОФЕН,Пероральные твердые обычные,18,0.8644658333333334,0.13553416666666665,0.8175122777777778,0.1824877222222222,287.87350000000004,103.93789999999998,391.81129999999996,3.5,SUBSTITUTABLE
909843,"ЕВРОФАСТ СОФТКАПС, Euro Lifecare  (Великобритания), капс. мягкие 200 мг блистер, в карт. коробке, #20",3138,ИБУПРОФЕН,Пероральные твердые обычные,6,0.9116566666666667,0.08834333333333333,0.8391736666666666,0.16082633333333332,434.2315,13.6087,447.8402,7.666666666666667,SUBSTITUTABLE
954397,"НУРОФЕН ФОРТЕ, Reckitt Benckiser Healthcare International  (Великобритания), табл. п/о 400 мг, #24",3138,ИБУПРОФЕН,Пероральные твердые обычные,10,0.7913121999999999,0.2086878,0.8259408,0.1740592,94.8928,26.4868,121.3795,1.6,SUBSTITUTABLE
1014022,"НО-ШПА® ДЛЯ ИНЪЕКЦИЙ, Opella Healthcare International  (Франция), р-р д/ин. 40 мг амп. 2 мл, #25",3147,ДРОТАВЕРИН,Парентеральные обычные,22,0.0,1.0,,,0.0,19.7142,19.7142,1.8181818181818181,CRITICAL
