DRUGS_ID,DRUGS_NAME,INN_ID,INN_NAME,NFC1_ID,EVENTS_COUNT,SHARE_INTERNAL,SHARE_LOST,SHARE_SAME_NFC1,SHARE_DIFF_NFC1,INTERNAL_LIFT,LOST_SALES,TOTAL_EFFECT,AVG_STOCKOUT_WEEKS,CLASSIFICATION
639788,"ДИКЛОСЕЙФ® ФОРТЕ, Кусум Фарм ООО (Украина, Киев), гель эмулс. д/наруж. прим. 2,32 % туба 100 г, #1",3170,ДИКЛОФЕНАК,"Местно действующие, дерматологические, антигеморроидальные, наружные",6,0.7771428333333333,0.22285716666666666,1.0,0.0,121.1,26.736000000000004,147.83599999999998,18.333333333333332,SUBSTITUTABLE
643137,"СОЛАРГИН, Macleods Pharmaceuticals Ltd (Индия), р-р д/инф. 42 мг/мл контейнер 100 мл, #1",350,АРГИНИН,Парентеральные обычные,3,0.5343383333333334,0.46566166666666664,1.0,0.0,7.6216,33.115500000000004,40.737100000000005,5.666666666666667,CRITICAL
650512,"БРУФЕН® РАПИД, Abbott Products GmbH  (Германия), капс. мягкие 400 мг блистер, #10",3138,ИБУПРОФЕН,Пероральные твердые обычные,23,0.8323228260869565,0.16767717391304346,0.7475218260869565,0.2524781739130435,449.876,72.9088,522.7847,4.217391304347826,SUBSTITUTABLE
654620,"ДЕЗЛОРАТАДИН-ТЕВА, Teva (Израиль), табл. п/плен. оболочкой 5 мг блистер, #10",40218,ДЕЗЛОРАТАДИН,Пероральные твердые обычные,4,0.75033375,0.24966625,0.4826745,0.5173255,48.7936,5.99,54.7836,11.0,SUBSTITUTABLE
654842,"НУРОФЕН ЭКСПРЕСС ФОРТЕ, Reckitt Benckiser Healthcare International  (Великобритания), капс. мягкие 400 мг, #20",3138,ИБУПРОФЕН,Пероральные твердые обычные,31,0.8248810645161291,0.17511893548387097,0.7143811612903226,0.2856188387096774,365.47700000000003,61.3894,426.86629999999997,2.3225806451612905,SUBSTITUTABLE
660135,"ЭРИДЕЗ, Дарница ЧАО (Украина, Киев), табл., дисперг. в рот. полости 5 мг блистер, #10",40218,ДЕЗЛОРАТАДИН,Пероральные твердые обычные,3,0.8180263333333334,0.18197366666666667,0.5527366666666667,0.44726333333333335,33.9453,7.122199999999999,41.067499999999995,18.0,SUBSTITUTABLE
671175,"ЭКЗО-ТИФИН, Здоровье Группа компаний ООО (Украина, Харьков), р-р накожный 10 мг/г фл. 20 мл, #1",2963,НАФТИФИН,"Местно действующие, дерматологические, антигеморроидальные, наружные",6,0.5743768333333333,0.4256231666666667,1.0,0.0,51.1299,9.2797,60.4096,6.666666666666667,CRITICAL
684691,"БРУФЕН® РЕТАРД, Abbott Products GmbH  (Германия), табл. пролонг. п/плен. обол. 800 мг блистер, #14",3138,ИБУПРОФЕН,Пероральные твердые длительно действующие,7,0.952726142857143,0.047273857142857145,0.0,1.0,460.6798,31.390700000000002,492.0704,16.571428571428573,SUBSTITUTABLE
686104,"ЭЗАНТАЛ, Микрохим ООО НПФ (Украина, Киев), табл. п/плен. оболочкой 20 мг блистер, #30",60436,ЛЕРКАНИДИПИН,Пероральные твердые обычные,2,0.9427165,0.0572835,1.0,0.0,31.231099999999998,1.25,32.4811,18.5,SUBSTITUTABLE
702760,"ДИКЛОФЕНАК, Виола ФФ ЧАО (Украина, Запорожье), гель 5 % туба алюм. 50 г, в пачке",3170,ДИКЛОФЕНАК,"Местно действующие, дерматологические, антигеморроидальные, наружные",3,0.5041836666666667,0.49581633333333336,1.0,0.0,11.3552,4.4832,15.8383,2.0,CRITICAL
716756,"ИБУПРОФЕН-ЗДОРОВЬЕ, Здоровье Группа компаний ООО (Украина, Харьков), капс. 400 мг блистер, #20",3138,ИБУПРОФЕН,Пероральные твердые обычные,2,0.9768475,0.0231525,0.8617015,0.1382985,462.7425,7.87,470.6125,43.5,SUBSTITUTABLE
725970,"ВАНЛЕРК, Киевский витаминный завод АО (Украина, Киев), табл. п/плен. оболочкой 20 мг блистер, #30",60436,ЛЕРКАНИДИПИН,Пероральные твердые обычные,1,0.84798,0.15202,1.0,0.0,4.9087,0.88,5.7887,4.0,SUBSTITUTABLE
741033,"НУРОФЕН ЭКСПРЕСС УЛЬТРАКАП, Reckitt Benckiser Healthcare International  (Великобритания), капс. мягкие 200 мг, #16",3138,ИБУПРОФЕН,Пероральные твердые обычные,14,0.9241644999999999,0.07583549999999999,0.7694170714285714,0.23058292857142856,571.3620999999999,39.4959,610.8581,8.5,SUBSTITUTABLE
746868,"ДИКЛОФЕНАК-ТЕВА ФОРТЕ 2%, Teva (Израиль), гель 2 % туба 50 г, #1",3170,ДИКЛОФЕНАК,"Местно действующие, дерматологические, антигеморроидальные, наружные",3,0.8693923333333333,0.13060766666666668,1.0,0.0,20.990000000000002,3.0,23.990000000000002,8.666666666666666,SUBSTITUTABLE
757899,"НО-ШПА® ФОРТЕ, Opella Healthcare International  (Франция), табл. 80 мг блистер, #10",3147,ДРОТАВЕРИН,Пероральные твердые обычные,23,0.4780056956521739,0.5219943043478261,1.0,0.0,52.4766,179.2356,231.7122,3.8260869565217392,CRITICAL
761708,"БИЛАГИС, Фармак АО (Украина, Киев), табл. 20 мг блистер, #10",298137,БИЛАСТИН,Пероральные твердые обычные,3,0.585606,0.414394,1.0,0.0,8.898399999999999,2.6340000000000003,11.532399999999999,8.333333333333334,CRITICAL
761709,"БИЛАГИС, Фармак АО (Украина, Киев), табл. 20 мг блистер, #30",298137,БИЛАСТИН,Пероральные твердые обычные,10,0.54327,0.45672999999999997,1.0,0.0,19.5613,11.135,30.6963,3.1,CRITICAL
773377,"ЗОНИК, Кусум Фарм ООО (Украина, Киев), капс. тверд. 25 мг блистер, #28",80617,ПРЕГАБАЛИН,Пероральные твердые обычные,3,0.5313983333333333,0.46860166666666664,1.0,0.0,9.02,10.66,19.68,10.333333333333334,CRITICAL
775520,"ДАРФЕН® ЭКСПРЕСС, Дарница ЧАО (Украина, Киев), сусп. оральн. 200 мг/10 мл саше 10 мл, #10",3138,ИБУПРОФЕН,Пероральные жидкие обычные,9,0.9696816666666668,0.030318333333333336,0.3138368888888889,0.6861631111111111,355.7742,23.6905,379.4647,9.666666666666666,SUBSTITUTABLE
813369,"ЭДОКСАКОРД, Киевский витаминный завод АО (Украина, Киев), табл. п/плен. оболочкой 60 мг блистер, #30",790221,ЭДОКСАБАН,Пероральные твердые обычные,6,0.16666666666666666,0.8333333333333334,1.0,0.0,1.0,38.1156,39.1156,15.0,CRITICAL
813371,"ЭДОКСАКОРД, Киевский витаминный завод АО (Украина, Киев), табл. п/плен. оболочкой 30 мг блистер, #30",790221,ЭДОКСАБАН,Пероральные твердые обычные,2,0.0,1.0,,,0.0,16.8612,16.8612,13.5,CRITICAL
814025,"ОЛФЕН® ГИДРОГЕЛЬ, Teva (Израиль), гель 1 % туба 100 г",3170,ДИКЛОФЕНАК,"Местно действующие, дерматологические, антигеморроидальные, наружные",2,0.939565,0.060435,1.0,0.0,62.25,4.01,66.26,32.0,SUBSTITUTABLE
822325,"ОЛФЕН® ФОРТЕ ГИДРОГЕЛЬ, Teva (Израиль), гель 2 % туба 100 г, #1",3170,ДИКЛОФЕНАК,"Местно действующие, дерматологические, антигеморроидальные, наружные",5,0.8076985999999999,0.1923014,1.0,0.0,59.446799999999996,12.8472,72.294,9.0,SUBSTITUTABLE
825568,"ПРЕГАБАЛИН-ТЕВА, Teva (Израиль), капс. тверд. 75 мг блистер, #28",80617,ПРЕГАБАЛИН,Пероральные твердые обычные,8,0.665461625,0.334538375,1.0,0.0,32.4398,16.8783,49.3181,4.0,SUBSTITUTABLE
832883,"ДОЛГИТ® КРЕМ, Naturwaren (Германия), крем туба 150 г, #1",3138,ИБУПРОФЕН,"Местно действующие, дерматологические, антигеморроидальные, наружные",6,0.3050796666666667,0.6949203333333333,1.0,0.0,16.509999999999998,28.7644,45.2744,10.833333333333334,CRITICAL
884852,"ДИКЛОФЕНАК, Лубныфарм АО (Украина, Лубны), гель 50 мг/г туба 40 г, в пачке, #1",3170,ДИКЛОФЕНАК,"Местно действующие, дерматологические, антигеморроидальные, наружные",2,0.7329025,0.2670975,1.0,0.0,6.755,2.0,8.754999999999999,4.0,SUBSTITUTABLE
890802,"ДИКЛАК® ГЕЛЬ, Sandoz (Швейцария), гель 5 % туба 150 г, #1",3170,ДИКЛОФЕНАК,"Местно действующие, дерматологические, антигеморроидальные, наружные",2,0.7637974999999999,0.23620249999999998,1.0,0.0,48.7094,16.73,65.4394,31.0,SUBSTITUTABLE
909840,"ЕВРОФАСТ СОФТКАПС, Euro Lifecare  (Великобритания), капс. мягкие 400 мг блистер, в карт. коробке, #20",3138,ИБУПРОФЕН,Пероральные твердые обычные,8,0.792207625,0.207792375,0.800462375,0.199537625,287.2987,80.8285,368.1273,6.625,SUBSTITUTABLE
909843,"ЕВРОФАСТ СОФТКАПС, Euro Lifecare  (Великобритания), капс. мягкие 200 мг блистер, в карт. коробке, #20",3138,ИБУПРОФЕН,Пероральные твердые обычные,4,0.9498285,0.0501715,0.81711725,0.18288274999999998,236.12130000000002,11.706299999999999,247.82760000000002,9.25,SUBSTITUTABLE
921683,"ПРЕГАБАЛИН АСИНО, Acino (Швейцария), капс. 150 мг блистер, #30",80617,ПРЕГАБАЛИН,Пероральные твердые обычные,3,0.7125363333333333,0.2874636666666666,1.0,0.0,34.0643,12.3498,46.414100000000005,6.0,SUBSTITUTABLE
954397,"НУРОФЕН ФОРТЕ, Reckitt Benckiser Healthcare International  (Великобритания), табл. п/о 400 мг, #24",3138,ИБУПРОФЕН,Пероральные твердые обычные,11,0.8901404545454544,0.10985954545454546,0.7955154545454545,0.20448454545454545,203.09130000000002,29.3857,232.4769,2.272727272727273,SUBSTITUTABLE
1014022,"НО-ШПА® ДЛЯ ИНЪЕКЦИЙ, Opella Healthcare International  (Франция), р-р д/ин. 40 мг амп. 2 мл, #25",3147,ДРОТАВЕРИН,Парентеральные обычные,17,0.1325655294117647,0.8674344705882353,1.0,0.0,1.5653,15.685,17.2503,3.7058823529411766,CRITICAL
